<?xml version="1.0"?>
<!DOCTYPE Columnas SYSTEM "etc/ETL.dtd">
<Columnas>
	<dis id="departamento">
		<cte>CONSTRUCCIONES ARQUITECTONICAS</cte>
		<cte>CIENCIA DE LA COMPUTACION E INT. ARTIF.</cte>
		<cte>EXPRESION GRAFICA Y CARTOGRAFIA</cte>
		<cte>FILOLOGIA INGLESA</cte>
		<cte>FISICA, INGENIERIA DE SISTEMAS Y TEORIA.</cte>
		<cte>GEOGRAFIA HUMANA</cte>
		<cte>INGENIERIA DE LA CONSTR.,OBRAS PUBL. E</cte>
		<cte>LENGUAJES Y SISTEMAS INFORMATICOS</cte>
		<cte>MATEMATICA APLICADA</cte>
		<cte>TECNOLOGIA INFORMATICA Y COMPUTACION</cte>
		<cte>ECONOMIA FINANCIERA, CONTABILIDAD Y MARK</cte>
	</dis>
</Columnas>
